No.,Time,Source,Destination,Protocol,Length,Info
1,0,10.0.1.2,10.0.1.3,TCP,74,33917  >  10 [SYN] Seq=0 Win=32120 Len=0 MSS=1460 SACK_PERM=1 TSval=3296992349 TSecr=0 WS=128
4,0.0004665,10.0.1.3,10.0.1.2,TCP,54,"10  >  33917 [RST, ACK] Seq=1 Ack=1 Win=0 Len=0"
5,0.0017069,10.0.1.2,10.0.1.3,TCP,74,43113  >  1 [SYN] Seq=0 Win=32120 Len=0 MSS=1460 SACK_PERM=1 TSval=3296992351 TSecr=0 WS=128
6,0.0021785,10.0.1.3,10.0.1.2,TCP,54,"1  >  43113 [RST, ACK] Seq=1 Ack=1 Win=0 Len=0"
7,0.0033514,10.0.1.2,10.0.1.3,TCP,74,40455  >  2 [SYN] Seq=0 Win=32120 Len=0 MSS=1460 SACK_PERM=1 TSval=3296992353 TSecr=0 WS=128
8,0.0035395,10.0.1.3,10.0.1.2,TCP,54,"2  >  40455 [RST, ACK] Seq=1 Ack=1 Win=0 Len=0"
9,0.0047544,10.0.1.2,10.0.1.3,TCP,74,41973  >  3 [SYN] Seq=0 Win=32120 Len=0 MSS=1460 SACK_PERM=1 TSval=3296992354 TSecr=0 WS=128
10,0.0049619,10.0.1.3,10.0.1.2,TCP,54,"3  >  41973 [RST, ACK] Seq=1 Ack=1 Win=0 Len=0"
11,0.0070526,10.0.1.2,10.0.1.3,TCP,74,39085  >  4 [SYN] Seq=0 Win=32120 Len=0 MSS=1460 SACK_PERM=1 TSval=3296992356 TSecr=0 WS=128
12,0.0073787,10.0.1.3,10.0.1.2,TCP,54,"4  >  39085 [RST, ACK] Seq=1 Ack=1 Win=0 Len=0"
13,0.0086652,10.0.1.2,10.0.1.3,TCP,74,42735  >  5 [SYN] Seq=0 Win=32120 Len=0 MSS=1460 SACK_PERM=1 TSval=3296992358 TSecr=0 WS=128
14,0.008903,10.0.1.3,10.0.1.2,TCP,54,"5  >  42735 [RST, ACK] Seq=1 Ack=1 Win=0 Len=0"
15,0.0103154,10.0.1.2,10.0.1.3,TCP,74,43623  >  6 [SYN] Seq=0 Win=32120 Len=0 MSS=1460 SACK_PERM=1 TSval=3296992360 TSecr=0 WS=128
16,0.0105579,10.0.1.3,10.0.1.2,TCP,54,"6  >  43623 [RST, ACK] Seq=1 Ack=1 Win=0 Len=0"
17,0.0116145,10.0.1.2,10.0.1.3,TCP,74,34345  >  7 [SYN] Seq=0 Win=32120 Len=0 MSS=1460 SACK_PERM=1 TSval=3296992361 TSecr=0 WS=128
18,0.0118452,10.0.1.3,10.0.1.2,TCP,54,"7  >  34345 [RST, ACK] Seq=1 Ack=1 Win=0 Len=0"
19,0.0133644,10.0.1.2,10.0.1.3,TCP,74,46109  >  8 [SYN] Seq=0 Win=32120 Len=0 MSS=1460 SACK_PERM=1 TSval=3296992363 TSecr=0 WS=128
20,0.0135319,10.0.1.3,10.0.1.2,TCP,54,"8  >  46109 [RST, ACK] Seq=1 Ack=1 Win=0 Len=0"
21,0.0141097,10.0.1.2,10.0.1.3,TCP,74,45015  >  9 [SYN] Seq=0 Win=32120 Len=0 MSS=1460 SACK_PERM=1 TSval=3296992363 TSecr=0 WS=128
22,0.0142988,10.0.1.3,10.0.1.2,TCP,54,"9  >  45015 [RST, ACK] Seq=1 Ack=1 Win=0 Len=0"
23,0.0600693,10.0.1.2,10.0.1.3,TCP,74,45435  >  11 [SYN] Seq=0 Win=32120 Len=0 MSS=1460 SACK_PERM=1 TSval=3296992409 TSecr=0 WS=128
24,0.0604453,10.0.1.3,10.0.1.2,TCP,54,"11  >  45435 [RST, ACK] Seq=1 Ack=1 Win=0 Len=0"
25,0.0604851,10.0.1.2,10.0.1.3,TCP,74,42847  >  12 [SYN] Seq=0 Win=32120 Len=0 MSS=1460 SACK_PERM=1 TSval=3296992410 TSecr=0 WS=128
26,0.0606685,10.0.1.3,10.0.1.2,TCP,54,"12  >  42847 [RST, ACK] Seq=1 Ack=1 Win=0 Len=0"
27,0.0608843,10.0.1.2,10.0.1.3,TCP,74,41101  >  15 [SYN] Seq=0 Win=32120 Len=0 MSS=1460 SACK_PERM=1 TSval=3296992410 TSecr=0 WS=128
28,0.0610611,10.0.1.3,10.0.1.2,TCP,54,"15  >  41101 [RST, ACK] Seq=1 Ack=1 Win=0 Len=0"
29,0.0612402,10.0.1.2,10.0.1.3,TCP,74,42569  >  14 [SYN] Seq=0 Win=32120 Len=0 MSS=1460 SACK_PERM=1 TSval=3296992411 TSecr=0 WS=128
30,0.0622967,10.0.1.3,10.0.1.2,TCP,54,"14  >  42569 [RST, ACK] Seq=1 Ack=1 Win=0 Len=0"
31,0.071659,10.0.1.2,10.0.1.3,TCP,74,33619  >  13 [SYN] Seq=0 Win=32120 Len=0 MSS=1460 SACK_PERM=1 TSval=3296992421 TSecr=0 WS=128
32,0.0765541,10.0.1.3,10.0.1.2,TCP,54,"13  >  33619 [RST, ACK] Seq=1 Ack=1 Win=0 Len=0"
33,0.0846133,10.0.1.2,10.0.1.3,TCP,74,43169  >  16 [SYN] Seq=0 Win=32120 Len=0 MSS=1460 SACK_PERM=1 TSval=3296992434 TSecr=0 WS=128
34,0.0850164,10.0.1.3,10.0.1.2,TCP,54,"16  >  43169 [RST, ACK] Seq=1 Ack=1 Win=0 Len=0"
35,0.0982181,10.0.1.2,10.0.1.3,TCP,74,33751  >  17 [SYN] Seq=0 Win=32120 Len=0 MSS=1460 SACK_PERM=1 TSval=3296992448 TSecr=0 WS=128
36,0.0988381,10.0.1.3,10.0.1.2,TCP,54,"17  >  33751 [RST, ACK] Seq=1 Ack=1 Win=0 Len=0"
37,0.1039519,10.0.1.2,10.0.1.3,TCP,74,42045  >  18 [SYN] Seq=0 Win=32120 Len=0 MSS=1460 SACK_PERM=1 TSval=3296992453 TSecr=0 WS=128
38,0.1093303,10.0.1.3,10.0.1.2,TCP,54,"18  >  42045 [RST, ACK] Seq=1 Ack=1 Win=0 Len=0"
39,0.1117103,10.0.1.2,10.0.1.3,TCP,74,36161  >  20 [SYN] Seq=0 Win=32120 Len=0 MSS=1460 SACK_PERM=1 TSval=3296992461 TSecr=0 WS=128
40,0.1120882,10.0.1.3,10.0.1.2,TCP,54,"20  >  36161 [RST, ACK] Seq=1 Ack=1 Win=0 Len=0"
41,0.1162911,10.0.1.2,10.0.1.3,TCP,74,35457  >  19 [SYN] Seq=0 Win=32120 Len=0 MSS=1460 SACK_PERM=1 TSval=3296992466 TSecr=0 WS=128
42,0.1167897,10.0.1.3,10.0.1.2,TCP,54,"19  >  35457 [RST, ACK] Seq=1 Ack=1 Win=0 Len=0"
43,0.1382269,10.0.1.2,10.0.1.3,TCP,74,46483  >  22 [SYN] Seq=0 Win=32120 Len=0 MSS=1460 SACK_PERM=1 TSval=3296992488 TSecr=0 WS=128
44,0.1395371,10.0.1.2,10.0.1.3,TCP,74,38457  >  25 [SYN] Seq=0 Win=32120 Len=0 MSS=1460 SACK_PERM=1 TSval=3296992489 TSecr=0 WS=128
45,0.1403949,10.0.1.3,10.0.1.2,TCP,54,"25  >  38457 [RST, ACK] Seq=1 Ack=1 Win=0 Len=0"
46,0.1404541,10.0.1.3,10.0.1.2,TCP,54,"22  >  46483 [RST, ACK] Seq=1 Ack=1 Win=0 Len=0"
47,0.1427047,10.0.1.2,10.0.1.3,TCP,74,45895  >  24 [SYN] Seq=0 Win=32120 Len=0 MSS=1460 SACK_PERM=1 TSval=3296992492 TSecr=0 WS=128
48,0.1430938,10.0.1.3,10.0.1.2,TCP,54,"24  >  45895 [RST, ACK] Seq=1 Ack=1 Win=0 Len=0"
49,0.1515904,10.0.1.2,10.0.1.3,TCP,74,41505  >  21 [SYN] Seq=0 Win=32120 Len=0 MSS=1460 SACK_PERM=1 TSval=3296992501 TSecr=0 WS=128
50,0.15197,10.0.1.3,10.0.1.2,TCP,54,"21  >  41505 [RST, ACK] Seq=1 Ack=1 Win=0 Len=0"
51,0.1639482,10.0.1.2,10.0.1.3,TCP,74,40345  >  23 [SYN] Seq=0 Win=32120 Len=0 MSS=1460 SACK_PERM=1 TSval=3296992513 TSecr=0 WS=128
52,0.1706126,10.0.1.3,10.0.1.2,TCP,54,"23  >  40345 [RST, ACK] Seq=1 Ack=1 Win=0 Len=0"
53,0.1711235,10.0.1.2,10.0.1.3,TCP,74,34125  >  26 [SYN] Seq=0 Win=32120 Len=0 MSS=1460 SACK_PERM=1 TSval=3296992521 TSecr=0 WS=128
54,0.1713691,10.0.1.3,10.0.1.2,TCP,54,"26  >  34125 [RST, ACK] Seq=1 Ack=1 Win=0 Len=0"
55,0.1790295,10.0.1.2,10.0.1.3,TCP,74,39151  >  27 [SYN] Seq=0 Win=32120 Len=0 MSS=1460 SACK_PERM=1 TSval=3296992528 TSecr=0 WS=128
56,0.1794018,10.0.1.3,10.0.1.2,TCP,54,"27  >  39151 [RST, ACK] Seq=1 Ack=1 Win=0 Len=0"
57,0.1844369,10.0.1.2,10.0.1.3,TCP,74,45315  >  30 [SYN] Seq=0 Win=32120 Len=0 MSS=1460 SACK_PERM=1 TSval=3296992534 TSecr=0 WS=128
58,0.1848704,10.0.1.3,10.0.1.2,TCP,54,"30  >  45315 [RST, ACK] Seq=1 Ack=1 Win=0 Len=0"
59,0.1979514,10.0.1.2,10.0.1.3,TCP,74,43623  >  28 [SYN] Seq=0 Win=32120 Len=0 MSS=1460 SACK_PERM=1 TSval=3296992547 TSecr=0 WS=128
60,0.1983404,10.0.1.3,10.0.1.2,TCP,54,"28  >  43623 [RST, ACK] Seq=1 Ack=1 Win=0 Len=0"
61,0.2185229,10.0.1.2,10.0.1.3,TCP,74,45995  >  29 [SYN] Seq=0 Win=32120 Len=0 MSS=1460 SACK_PERM=1 TSval=3296992568 TSecr=0 WS=128
62,0.2188041,10.0.1.3,10.0.1.2,TCP,54,"29  >  45995 [RST, ACK] Seq=1 Ack=1 Win=0 Len=0"
63,0.252938,10.0.1.2,10.0.1.3,TCP,74,45301  >  33 [SYN] Seq=0 Win=32120 Len=0 MSS=1460 SACK_PERM=1 TSval=3296992602 TSecr=0 WS=128
64,0.2534247,10.0.1.3,10.0.1.2,TCP,54,"33  >  45301 [RST, ACK] Seq=1 Ack=1 Win=0 Len=0"
65,0.2609539,10.0.1.2,10.0.1.3,TCP,74,35453  >  32 [SYN] Seq=0 Win=32120 Len=0 MSS=1460 SACK_PERM=1 TSval=3296992610 TSecr=0 WS=128
66,0.2614799,10.0.1.3,10.0.1.2,TCP,54,"32  >  35453 [RST, ACK] Seq=1 Ack=1 Win=0 Len=0"
67,0.2754678,10.0.1.2,10.0.1.3,TCP,74,34097  >  31 [SYN] Seq=0 Win=32120 Len=0 MSS=1460 SACK_PERM=1 TSval=3296992625 TSecr=0 WS=128
68,0.2758779,10.0.1.3,10.0.1.2,TCP,54,"31  >  34097 [RST, ACK] Seq=1 Ack=1 Win=0 Len=0"
69,0.2818358,10.0.1.2,10.0.1.3,TCP,74,37091  >  34 [SYN] Seq=0 Win=32120 Len=0 MSS=1460 SACK_PERM=1 TSval=3296992631 TSecr=0 WS=128
70,0.2822855,10.0.1.3,10.0.1.2,TCP,54,"34  >  37091 [RST, ACK] Seq=1 Ack=1 Win=0 Len=0"
71,0.2889282,10.0.1.2,10.0.1.3,TCP,74,35939  >  35 [SYN] Seq=0 Win=32120 Len=0 MSS=1460 SACK_PERM=1 TSval=3296992638 TSecr=0 WS=128
72,0.2893194,10.0.1.3,10.0.1.2,TCP,54,"35  >  35939 [RST, ACK] Seq=1 Ack=1 Win=0 Len=0"
73,0.2996278,10.0.1.2,10.0.1.3,TCP,74,34501  >  37 [SYN] Seq=0 Win=32120 Len=0 MSS=1460 SACK_PERM=1 TSval=3296992649 TSecr=0 WS=128
74,0.3000203,10.0.1.3,10.0.1.2,TCP,54,"37  >  34501 [RST, ACK] Seq=1 Ack=1 Win=0 Len=0"
75,0.3120608,10.0.1.2,10.0.1.3,TCP,74,39813  >  40 [SYN] Seq=0 Win=32120 Len=0 MSS=1460 SACK_PERM=1 TSval=3296992661 TSecr=0 WS=128
76,0.3124907,10.0.1.3,10.0.1.2,TCP,54,"40  >  39813 [RST, ACK] Seq=1 Ack=1 Win=0 Len=0"
77,0.3219422,10.0.1.2,10.0.1.3,TCP,74,41975  >  39 [SYN] Seq=0 Win=32120 Len=0 MSS=1460 SACK_PERM=1 TSval=3296992671 TSecr=0 WS=128
78,0.3236511,10.0.1.3,10.0.1.2,TCP,54,"39  >  41975 [RST, ACK] Seq=1 Ack=1 Win=0 Len=0"
79,0.3367126,10.0.1.2,10.0.1.3,TCP,74,38059  >  36 [SYN] Seq=0 Win=32120 Len=0 MSS=1460 SACK_PERM=1 TSval=3296992686 TSecr=0 WS=128
80,0.3371127,10.0.1.3,10.0.1.2,TCP,54,"36  >  38059 [RST, ACK] Seq=1 Ack=1 Win=0 Len=0"
81,0.3793335,10.0.1.2,10.0.1.3,TCP,74,35415  >  38 [SYN] Seq=0 Win=32120 Len=0 MSS=1460 SACK_PERM=1 TSval=3296992729 TSecr=0 WS=128
82,0.3797465,10.0.1.3,10.0.1.2,TCP,54,"38  >  35415 [RST, ACK] Seq=1 Ack=1 Win=0 Len=0"
83,0.3847265,10.0.1.2,10.0.1.3,TCP,74,40223  >  50 [SYN] Seq=0 Win=32120 Len=0 MSS=1460 SACK_PERM=1 TSval=3296992734 TSecr=0 WS=128
84,0.3850661,10.0.1.3,10.0.1.2,TCP,54,"50  >  40223 [RST, ACK] Seq=1 Ack=1 Win=0 Len=0"
85,0.3856887,10.0.1.2,10.0.1.3,TCP,74,45725  >  41 [SYN] Seq=0 Win=32120 Len=0 MSS=1460 SACK_PERM=1 TSval=3296992735 TSecr=0 WS=128
86,0.3859373,10.0.1.3,10.0.1.2,TCP,54,"41  >  45725 [RST, ACK] Seq=1 Ack=1 Win=0 Len=0"
87,0.3861043,10.0.1.2,10.0.1.3,TCP,74,35635  >  42 [SYN] Seq=0 Win=32120 Len=0 MSS=1460 SACK_PERM=1 TSval=3296992735 TSecr=0 WS=128
88,0.3863432,10.0.1.3,10.0.1.2,TCP,54,"42  >  35635 [RST, ACK] Seq=1 Ack=1 Win=0 Len=0"
89,0.3865857,10.0.1.2,10.0.1.3,TCP,74,43421  >  43 [SYN] Seq=0 Win=32120 Len=0 MSS=1460 SACK_PERM=1 TSval=3296992736 TSecr=0 WS=128
90,0.3867671,10.0.1.3,10.0.1.2,TCP,54,"43  >  43421 [RST, ACK] Seq=1 Ack=1 Win=0 Len=0"
91,0.3870523,10.0.1.2,10.0.1.3,TCP,74,33717  >  44 [SYN] Seq=0 Win=32120 Len=0 MSS=1460 SACK_PERM=1 TSval=3296992736 TSecr=0 WS=128
92,0.3872767,10.0.1.3,10.0.1.2,TCP,54,"44  >  33717 [RST, ACK] Seq=1 Ack=1 Win=0 Len=0"
93,0.3877455,10.0.1.2,10.0.1.3,TCP,74,37639  >  45 [SYN] Seq=0 Win=32120 Len=0 MSS=1460 SACK_PERM=1 TSval=3296992737 TSecr=0 WS=128
94,0.3879106,10.0.1.3,10.0.1.2,TCP,54,"45  >  37639 [RST, ACK] Seq=1 Ack=1 Win=0 Len=0"
95,0.3881477,10.0.1.2,10.0.1.3,TCP,74,34113  >  46 [SYN] Seq=0 Win=32120 Len=0 MSS=1460 SACK_PERM=1 TSval=3296992738 TSecr=0 WS=128
96,0.388305,10.0.1.3,10.0.1.2,TCP,54,"46  >  34113 [RST, ACK] Seq=1 Ack=1 Win=0 Len=0"
97,0.3885613,10.0.1.2,10.0.1.3,TCP,74,37763  >  47 [SYN] Seq=0 Win=32120 Len=0 MSS=1460 SACK_PERM=1 TSval=3296992738 TSecr=0 WS=128
98,0.3886622,10.0.1.3,10.0.1.2,TCP,54,"47  >  37763 [RST, ACK] Seq=1 Ack=1 Win=0 Len=0"
99,0.3895101,10.0.1.2,10.0.1.3,TCP,74,38329  >  48 [SYN] Seq=0 Win=32120 Len=0 MSS=1460 SACK_PERM=1 TSval=3296992739 TSecr=0 WS=128
100,0.3896964,10.0.1.3,10.0.1.2,TCP,54,"48  >  38329 [RST, ACK] Seq=1 Ack=1 Win=0 Len=0"
101,0.3899096,10.0.1.2,10.0.1.3,TCP,74,38313  >  49 [SYN] Seq=0 Win=32120 Len=0 MSS=1460 SACK_PERM=1 TSval=3296992739 TSecr=0 WS=128
102,0.3901352,10.0.1.3,10.0.1.2,TCP,54,"49  >  38313 [RST, ACK] Seq=1 Ack=1 Win=0 Len=0"
103,0.3957756,10.0.1.2,10.0.1.3,TCP,74,41531  >  51 [SYN] Seq=0 Win=32120 Len=0 MSS=1460 SACK_PERM=1 TSval=3296992745 TSecr=0 WS=128
104,0.3961193,10.0.1.3,10.0.1.2,TCP,54,"51  >  41531 [RST, ACK] Seq=1 Ack=1 Win=0 Len=0"
105,0.3965365,10.0.1.2,10.0.1.3,TCP,74,42875  >  53 [SYN] Seq=0 Win=32120 Len=0 MSS=1460 SACK_PERM=1 TSval=3296992746 TSecr=0 WS=128
106,0.3965728,10.0.1.2,10.0.1.3,TCP,74,35395  >  52 [SYN] Seq=0 Win=32120 Len=0 MSS=1460 SACK_PERM=1 TSval=3296992746 TSecr=0 WS=128
107,0.3968067,10.0.1.3,10.0.1.2,TCP,54,"52  >  35395 [RST, ACK] Seq=1 Ack=1 Win=0 Len=0"
108,0.3968194,10.0.1.3,10.0.1.2,TCP,54,"53  >  42875 [RST, ACK] Seq=1 Ack=1 Win=0 Len=0"
109,0.3974195,10.0.1.2,10.0.1.3,TCP,74,44339  >  54 [SYN] Seq=0 Win=32120 Len=0 MSS=1460 SACK_PERM=1 TSval=3296992747 TSecr=0 WS=128
110,0.3976424,10.0.1.3,10.0.1.2,TCP,54,"54  >  44339 [RST, ACK] Seq=1 Ack=1 Win=0 Len=0"
111,0.3978994,10.0.1.2,10.0.1.3,TCP,74,33955  >  55 [SYN] Seq=0 Win=32120 Len=0 MSS=1460 SACK_PERM=1 TSval=3296992747 TSecr=0 WS=128
112,0.3981365,10.0.1.3,10.0.1.2,TCP,54,"55  >  33955 [RST, ACK] Seq=1 Ack=1 Win=0 Len=0"
113,0.3983174,10.0.1.2,10.0.1.3,TCP,74,38131  >  56 [SYN] Seq=0 Win=32120 Len=0 MSS=1460 SACK_PERM=1 TSval=3296992748 TSecr=0 WS=128
114,0.3984819,10.0.1.3,10.0.1.2,TCP,54,"56  >  38131 [RST, ACK] Seq=1 Ack=1 Win=0 Len=0"
115,0.398753,10.0.1.2,10.0.1.3,TCP,74,45087  >  58 [SYN] Seq=0 Win=32120 Len=0 MSS=1460 SACK_PERM=1 TSval=3296992748 TSecr=0 WS=128
116,0.3989155,10.0.1.3,10.0.1.2,TCP,54,"58  >  45087 [RST, ACK] Seq=1 Ack=1 Win=0 Len=0"
117,0.3995939,10.0.1.2,10.0.1.3,TCP,74,33411  >  59 [SYN] Seq=0 Win=32120 Len=0 MSS=1460 SACK_PERM=1 TSval=3296992749 TSecr=0 WS=128
118,0.3997733,10.0.1.3,10.0.1.2,TCP,54,"59  >  33411 [RST, ACK] Seq=1 Ack=1 Win=0 Len=0"
119,0.400045,10.0.1.2,10.0.1.3,TCP,74,33747  >  57 [SYN] Seq=0 Win=32120 Len=0 MSS=1460 SACK_PERM=1 TSval=3296992749 TSecr=0 WS=128
120,0.4002006,10.0.1.3,10.0.1.2,TCP,54,"57  >  33747 [RST, ACK] Seq=1 Ack=1 Win=0 Len=0"
121,0.400459,10.0.1.2,10.0.1.3,TCP,74,35605  >  60 [SYN] Seq=0 Win=32120 Len=0 MSS=1460 SACK_PERM=1 TSval=3296992750 TSecr=0 WS=128
122,0.4006044,10.0.1.3,10.0.1.2,TCP,54,"60  >  35605 [RST, ACK] Seq=1 Ack=1 Win=0 Len=0"
123,0.4059853,10.0.1.2,10.0.1.3,TCP,74,46467  >  61 [SYN] Seq=0 Win=32120 Len=0 MSS=1460 SACK_PERM=1 TSval=3296992755 TSecr=0 WS=128
124,0.406335,10.0.1.3,10.0.1.2,TCP,54,"61  >  46467 [RST, ACK] Seq=1 Ack=1 Win=0 Len=0"
125,0.4064952,10.0.1.2,10.0.1.3,TCP,74,39475  >  64 [SYN] Seq=0 Win=32120 Len=0 MSS=1460 SACK_PERM=1 TSval=3296992756 TSecr=0 WS=128
126,0.4066804,10.0.1.3,10.0.1.2,TCP,54,"64  >  39475 [RST, ACK] Seq=1 Ack=1 Win=0 Len=0"
127,0.4074387,10.0.1.2,10.0.1.3,TCP,74,43877  >  65 [SYN] Seq=0 Win=32120 Len=0 MSS=1460 SACK_PERM=1 TSval=3296992757 TSecr=0 WS=128
128,0.4076247,10.0.1.3,10.0.1.2,TCP,54,"65  >  43877 [RST, ACK] Seq=1 Ack=1 Win=0 Len=0"
129,0.4078479,10.0.1.2,10.0.1.3,TCP,74,45877  >  66 [SYN] Seq=0 Win=32120 Len=0 MSS=1460 SACK_PERM=1 TSval=3296992757 TSecr=0 WS=128
130,0.4080426,10.0.1.3,10.0.1.2,TCP,54,"66  >  45877 [RST, ACK] Seq=1 Ack=1 Win=0 Len=0"
131,0.4082434,10.0.1.2,10.0.1.3,TCP,74,33641  >  67 [SYN] Seq=0 Win=32120 Len=0 MSS=1460 SACK_PERM=1 TSval=3296992758 TSecr=0 WS=128
132,0.4084685,10.0.1.3,10.0.1.2,TCP,54,"67  >  33641 [RST, ACK] Seq=1 Ack=1 Win=0 Len=0"
133,0.4088989,10.0.1.2,10.0.1.3,TCP,74,44763  >  68 [SYN] Seq=0 Win=32120 Len=0 MSS=1460 SACK_PERM=1 TSval=3296992758 TSecr=0 WS=128
134,0.4090814,10.0.1.3,10.0.1.2,TCP,54,"68  >  44763 [RST, ACK] Seq=1 Ack=1 Win=0 Len=0"
135,0.4096148,10.0.1.2,10.0.1.3,TCP,74,44539  >  69 [SYN] Seq=0 Win=32120 Len=0 MSS=1460 SACK_PERM=1 TSval=3296992759 TSecr=0 WS=128
136,0.4098409,10.0.1.3,10.0.1.2,TCP,54,"69  >  44539 [RST, ACK] Seq=1 Ack=1 Win=0 Len=0"
137,0.4100111,10.0.1.2,10.0.1.3,TCP,74,39733  >  62 [SYN] Seq=0 Win=32120 Len=0 MSS=1460 SACK_PERM=1 TSval=3296992759 TSecr=0 WS=128
138,0.4101794,10.0.1.3,10.0.1.2,TCP,54,"62  >  39733 [RST, ACK] Seq=1 Ack=1 Win=0 Len=0"
139,0.4104703,10.0.1.2,10.0.1.3,TCP,74,38547  >  63 [SYN] Seq=0 Win=32120 Len=0 MSS=1460 SACK_PERM=1 TSval=3296992760 TSecr=0 WS=128
140,0.4106527,10.0.1.3,10.0.1.2,TCP,54,"63  >  38547 [RST, ACK] Seq=1 Ack=1 Win=0 Len=0"
141,0.411114,10.0.1.2,10.0.1.3,TCP,74,39849  >  70 [SYN] Seq=0 Win=32120 Len=0 MSS=1460 SACK_PERM=1 TSval=3296992760 TSecr=0 WS=128
142,0.4112512,10.0.1.3,10.0.1.2,TCP,54,"70  >  39849 [RST, ACK] Seq=1 Ack=1 Win=0 Len=0"
143,0.4166621,10.0.1.2,10.0.1.3,TCP,74,34719  >  71 [SYN] Seq=0 Win=32120 Len=0 MSS=1460 SACK_PERM=1 TSval=3296992766 TSecr=0 WS=128
144,0.417124,10.0.1.3,10.0.1.2,TCP,54,"71  >  34719 [RST, ACK] Seq=1 Ack=1 Win=0 Len=0"
145,0.4175152,10.0.1.2,10.0.1.3,TCP,74,42085  >  74 [SYN] Seq=0 Win=32120 Len=0 MSS=1460 SACK_PERM=1 TSval=3296992767 TSecr=0 WS=128
146,0.4177412,10.0.1.3,10.0.1.2,TCP,54,"74  >  42085 [RST, ACK] Seq=1 Ack=1 Win=0 Len=0"
147,0.4179131,10.0.1.2,10.0.1.3,TCP,74,38085  >  75 [SYN] Seq=0 Win=32120 Len=0 MSS=1460 SACK_PERM=1 TSval=3296992767 TSecr=0 WS=128
148,0.4181466,10.0.1.3,10.0.1.2,TCP,54,"75  >  38085 [RST, ACK] Seq=1 Ack=1 Win=0 Len=0"
149,0.418301,10.0.1.2,10.0.1.3,TCP,74,43093  >  76 [SYN] Seq=0 Win=32120 Len=0 MSS=1460 SACK_PERM=1 TSval=3296992768 TSecr=0 WS=128
150,0.4185332,10.0.1.3,10.0.1.2,TCP,54,"76  >  43093 [RST, ACK] Seq=1 Ack=1 Win=0 Len=0"
151,0.4191048,10.0.1.2,10.0.1.3,TCP,74,40321  >  77 [SYN] Seq=0 Win=32120 Len=0 MSS=1460 SACK_PERM=1 TSval=3296992768 TSecr=0 WS=128
152,0.4193339,10.0.1.3,10.0.1.2,TCP,54,"77  >  40321 [RST, ACK] Seq=1 Ack=1 Win=0 Len=0"
153,0.4195234,10.0.1.2,10.0.1.3,TCP,74,35095  >  78 [SYN] Seq=0 Win=32120 Len=0 MSS=1460 SACK_PERM=1 TSval=3296992769 TSecr=0 WS=128
154,0.4196601,10.0.1.3,10.0.1.2,TCP,54,"78  >  35095 [RST, ACK] Seq=1 Ack=1 Win=0 Len=0"
155,0.4200036,10.0.1.2,10.0.1.3,TCP,74,45837  >  79 [SYN] Seq=0 Win=32120 Len=0 MSS=1460 SACK_PERM=1 TSval=3296992769 TSecr=0 WS=128
156,0.4200881,10.0.1.3,10.0.1.2,TCP,54,"79  >  45837 [RST, ACK] Seq=1 Ack=1 Win=0 Len=0"
157,0.4204159,10.0.1.2,10.0.1.3,TCP,74,42377  >  72 [SYN] Seq=0 Win=32120 Len=0 MSS=1460 SACK_PERM=1 TSval=3296992770 TSecr=0 WS=128
158,0.42053,10.0.1.3,10.0.1.2,TCP,54,"72  >  42377 [RST, ACK] Seq=1 Ack=1 Win=0 Len=0"
159,0.4210839,10.0.1.2,10.0.1.3,TCP,74,40559  >  73 [SYN] Seq=0 Win=32120 Len=0 MSS=1460 SACK_PERM=1 TSval=3296992770 TSecr=0 WS=128
160,0.4212581,10.0.1.3,10.0.1.2,TCP,54,"73  >  40559 [RST, ACK] Seq=1 Ack=1 Win=0 Len=0"
161,0.4214705,10.0.1.2,10.0.1.3,TCP,74,33135  >  80 [SYN] Seq=0 Win=32120 Len=0 MSS=1460 SACK_PERM=1 TSval=3296992771 TSecr=0 WS=128
162,0.4215889,10.0.1.3,10.0.1.2,TCP,54,"80  >  33135 [RST, ACK] Seq=1 Ack=1 Win=0 Len=0"
163,0.4271861,10.0.1.2,10.0.1.3,TCP,74,42239  >  81 [SYN] Seq=0 Win=32120 Len=0 MSS=1460 SACK_PERM=1 TSval=3296992777 TSecr=0 WS=128
164,0.4275051,10.0.1.3,10.0.1.2,TCP,54,"81  >  42239 [RST, ACK] Seq=1 Ack=1 Win=0 Len=0"
165,0.427611,10.0.1.2,10.0.1.3,TCP,74,40623  >  84 [SYN] Seq=0 Win=32120 Len=0 MSS=1460 SACK_PERM=1 TSval=3296992777 TSecr=0 WS=128
166,0.4278357,10.0.1.3,10.0.1.2,TCP,54,"84  >  40623 [RST, ACK] Seq=1 Ack=1 Win=0 Len=0"
167,0.4280391,10.0.1.2,10.0.1.3,TCP,74,42181  >  85 [SYN] Seq=0 Win=32120 Len=0 MSS=1460 SACK_PERM=1 TSval=3296992777 TSecr=0 WS=128
168,0.4282522,10.0.1.3,10.0.1.2,TCP,54,"85  >  42181 [RST, ACK] Seq=1 Ack=1 Win=0 Len=0"
169,0.4288676,10.0.1.2,10.0.1.3,TCP,74,38161  >  86 [SYN] Seq=0 Win=32120 Len=0 MSS=1460 SACK_PERM=1 TSval=3296992778 TSecr=0 WS=128
170,0.4290904,10.0.1.3,10.0.1.2,TCP,54,"86  >  38161 [RST, ACK] Seq=1 Ack=1 Win=0 Len=0"
171,0.4292923,10.0.1.2,10.0.1.3,TCP,74,33191  >  82 [SYN] Seq=0 Win=32120 Len=0 MSS=1460 SACK_PERM=1 TSval=3296992779 TSecr=0 WS=128
172,0.4294052,10.0.1.3,10.0.1.2,TCP,54,"82  >  33191 [RST, ACK] Seq=1 Ack=1 Win=0 Len=0"
173,0.429717,10.0.1.2,10.0.1.3,TCP,74,38643  >  88 [SYN] Seq=0 Win=32120 Len=0 MSS=1460 SACK_PERM=1 TSval=3296992779 TSecr=0 WS=128
174,0.4298852,10.0.1.3,10.0.1.2,TCP,54,"88  >  38643 [RST, ACK] Seq=1 Ack=1 Win=0 Len=0"
175,0.430193,10.0.1.2,10.0.1.3,TCP,74,33013  >  90 [SYN] Seq=0 Win=32120 Len=0 MSS=1460 SACK_PERM=1 TSval=3296992780 TSecr=0 WS=128
176,0.4303295,10.0.1.3,10.0.1.2,TCP,54,"90  >  33013 [RST, ACK] Seq=1 Ack=1 Win=0 Len=0"
177,0.4309667,10.0.1.2,10.0.1.3,TCP,74,44771  >  87 [SYN] Seq=0 Win=32120 Len=0 MSS=1460 SACK_PERM=1 TSval=3296992780 TSecr=0 WS=128
178,0.4311251,10.0.1.3,10.0.1.2,TCP,54,"87  >  44771 [RST, ACK] Seq=1 Ack=1 Win=0 Len=0"
179,0.4313934,10.0.1.2,10.0.1.3,TCP,74,38819  >  89 [SYN] Seq=0 Win=32120 Len=0 MSS=1460 SACK_PERM=1 TSval=3296992781 TSecr=0 WS=128
180,0.4315312,10.0.1.3,10.0.1.2,TCP,54,"89  >  38819 [RST, ACK] Seq=1 Ack=1 Win=0 Len=0"
181,0.4318377,10.0.1.2,10.0.1.3,TCP,74,37505  >  83 [SYN] Seq=0 Win=32120 Len=0 MSS=1460 SACK_PERM=1 TSval=3296992781 TSecr=0 WS=128
182,0.4319478,10.0.1.3,10.0.1.2,TCP,54,"83  >  37505 [RST, ACK] Seq=1 Ack=1 Win=0 Len=0"
183,0.4384915,10.0.1.2,10.0.1.3,TCP,74,34291  >  91 [SYN] Seq=0 Win=32120 Len=0 MSS=1460 SACK_PERM=1 TSval=3296992788 TSecr=0 WS=128
184,0.4387948,10.0.1.3,10.0.1.2,TCP,54,"91  >  34291 [RST, ACK] Seq=1 Ack=1 Win=0 Len=0"
185,0.4389219,10.0.1.2,10.0.1.3,TCP,74,35271  >  94 [SYN] Seq=0 Win=32120 Len=0 MSS=1460 SACK_PERM=1 TSval=3296992788 TSecr=0 WS=128
186,0.43913,10.0.1.3,10.0.1.2,TCP,54,"94  >  35271 [RST, ACK] Seq=1 Ack=1 Win=0 Len=0"
187,0.4396251,10.0.1.2,10.0.1.3,TCP,74,35995  >  95 [SYN] Seq=0 Win=32120 Len=0 MSS=1460 SACK_PERM=1 TSval=3296992789 TSecr=0 WS=128
188,0.4398524,10.0.1.3,10.0.1.2,TCP,54,"95  >  35995 [RST, ACK] Seq=1 Ack=1 Win=0 Len=0"
189,0.4400396,10.0.1.2,10.0.1.3,TCP,74,44357  >  97 [SYN] Seq=0 Win=32120 Len=0 MSS=1460 SACK_PERM=1 TSval=3296992789 TSecr=0 WS=128
190,0.4402607,10.0.1.3,10.0.1.2,TCP,54,"97  >  44357 [RST, ACK] Seq=1 Ack=1 Win=0 Len=0"
191,0.4404497,10.0.1.2,10.0.1.3,TCP,74,35905  >  99 [SYN] Seq=0 Win=32120 Len=0 MSS=1460 SACK_PERM=1 TSval=3296992790 TSecr=0 WS=128
192,0.4406208,10.0.1.3,10.0.1.2,TCP,54,"99  >  35905 [RST, ACK] Seq=1 Ack=1 Win=0 Len=0"
193,0.4411886,10.0.1.2,10.0.1.3,TCP,74,45349  >  100 [SYN] Seq=0 Win=32120 Len=0 MSS=1460 SACK_PERM=1 TSval=3296992791 TSecr=0 WS=128
194,0.4414186,10.0.1.3,10.0.1.2,TCP,54,"100  >  45349 [RST, ACK] Seq=1 Ack=1 Win=0 Len=0"
195,0.441594,10.0.1.2,10.0.1.3,TCP,74,44717  >  92 [SYN] Seq=0 Win=32120 Len=0 MSS=1460 SACK_PERM=1 TSval=3296992791 TSecr=0 WS=128
196,0.4417611,10.0.1.3,10.0.1.2,TCP,54,"92  >  44717 [RST, ACK] Seq=1 Ack=1 Win=0 Len=0"
197,0.4433618,10.0.1.2,10.0.1.3,TCP,74,43941  >  96 [SYN] Seq=0 Win=32120 Len=0 MSS=1460 SACK_PERM=1 TSval=3296992793 TSecr=0 WS=128
198,0.4433882,10.0.1.2,10.0.1.3,TCP,74,33705  >  93 [SYN] Seq=0 Win=32120 Len=0 MSS=1460 SACK_PERM=1 TSval=3296992793 TSecr=0 WS=128
199,0.4436003,10.0.1.3,10.0.1.2,TCP,54,"96  >  43941 [RST, ACK] Seq=1 Ack=1 Win=0 Len=0"
200,0.4436073,10.0.1.3,10.0.1.2,TCP,54,"93  >  33705 [RST, ACK] Seq=1 Ack=1 Win=0 Len=0"
201,0.4441903,10.0.1.2,10.0.1.3,TCP,74,36509  >  98 [SYN] Seq=0 Win=32120 Len=0 MSS=1460 SACK_PERM=1 TSval=3296992794 TSecr=0 WS=128
202,0.44437,10.0.1.3,10.0.1.2,TCP,54,"98  >  36509 [RST, ACK] Seq=1 Ack=1 Win=0 Len=0"
203,0.4507528,10.0.1.2,10.0.1.3,TCP,74,45875  >  103 [SYN] Seq=0 Win=32120 Len=0 MSS=1460 SACK_PERM=1 TSval=3296992800 TSecr=0 WS=128
204,0.4507803,10.0.1.2,10.0.1.3,TCP,74,44889  >  101 [SYN] Seq=0 Win=32120 Len=0 MSS=1460 SACK_PERM=1 TSval=3296992800 TSecr=0 WS=128
205,0.4511537,10.0.1.2,10.0.1.3,TCP,74,45085  >  104 [SYN] Seq=0 Win=32120 Len=0 MSS=1460 SACK_PERM=1 TSval=3296992801 TSecr=0 WS=128
206,0.4511782,10.0.1.3,10.0.1.2,TCP,54,"103  >  45875 [RST, ACK] Seq=1 Ack=1 Win=0 Len=0"
207,0.4511898,10.0.1.3,10.0.1.2,TCP,54,"101  >  44889 [RST, ACK] Seq=1 Ack=1 Win=0 Len=0"
208,0.451236,10.0.1.3,10.0.1.2,TCP,54,"104  >  45085 [RST, ACK] Seq=1 Ack=1 Win=0 Len=0"
209,0.4515541,10.0.1.2,10.0.1.3,TCP,74,33635  >  105 [SYN] Seq=0 Win=32120 Len=0 MSS=1460 SACK_PERM=1 TSval=3296992801 TSecr=0 WS=128
210,0.4517256,10.0.1.3,10.0.1.2,TCP,54,"105  >  33635 [RST, ACK] Seq=1 Ack=1 Win=0 Len=0"
211,0.452621,10.0.1.2,10.0.1.3,TCP,74,42605  >  102 [SYN] Seq=0 Win=32120 Len=0 MSS=1460 SACK_PERM=1 TSval=3296992802 TSecr=0 WS=128
212,0.4528314,10.0.1.3,10.0.1.2,TCP,54,"102  >  42605 [RST, ACK] Seq=1 Ack=1 Win=0 Len=0"
213,0.4530457,10.0.1.2,10.0.1.3,TCP,74,42677  >  106 [SYN] Seq=0 Win=32120 Len=0 MSS=1460 SACK_PERM=1 TSval=3296992802 TSecr=0 WS=128
214,0.4532366,10.0.1.3,10.0.1.2,TCP,54,"106  >  42677 [RST, ACK] Seq=1 Ack=1 Win=0 Len=0"
215,0.4534562,10.0.1.2,10.0.1.3,TCP,74,41393  >  108 [SYN] Seq=0 Win=32120 Len=0 MSS=1460 SACK_PERM=1 TSval=3296992803 TSecr=0 WS=128
216,0.4536784,10.0.1.3,10.0.1.2,TCP,54,"108  >  41393 [RST, ACK] Seq=1 Ack=1 Win=0 Len=0"
217,0.4538703,10.0.1.2,10.0.1.3,TCP,74,39723  >  107 [SYN] Seq=0 Win=32120 Len=0 MSS=1460 SACK_PERM=1 TSval=3296992803 TSecr=0 WS=128
218,0.4543124,10.0.1.3,10.0.1.2,TCP,54,"107  >  39723 [RST, ACK] Seq=1 Ack=1 Win=0 Len=0"
219,0.4545764,10.0.1.2,10.0.1.3,TCP,74,39729  >  109 [SYN] Seq=0 Win=32120 Len=0 MSS=1460 SACK_PERM=1 TSval=3296992804 TSecr=0 WS=128
220,0.45527,10.0.1.3,10.0.1.2,TCP,54,"109  >  39729 [RST, ACK] Seq=1 Ack=1 Win=0 Len=0"
221,0.4553659,10.0.1.2,10.0.1.3,TCP,74,43589  >  110 [SYN] Seq=0 Win=32120 Len=0 MSS=1460 SACK_PERM=1 TSval=3296992805 TSecr=0 WS=128
222,0.4555499,10.0.1.3,10.0.1.2,TCP,54,"110  >  43589 [RST, ACK] Seq=1 Ack=1 Win=0 Len=0"
223,0.4605472,10.0.1.2,10.0.1.3,TCP,74,41083  >  113 [SYN] Seq=0 Win=32120 Len=0 MSS=1460 SACK_PERM=1 TSval=3296992810 TSecr=0 WS=128
224,0.4609171,10.0.1.2,10.0.1.3,TCP,74,45075  >  111 [SYN] Seq=0 Win=32120 Len=0 MSS=1460 SACK_PERM=1 TSval=3296992810 TSecr=0 WS=128
225,0.4609353,10.0.1.3,10.0.1.2,TCP,54,"113  >  41083 [RST, ACK] Seq=1 Ack=1 Win=0 Len=0"
226,0.4610144,10.0.1.3,10.0.1.2,TCP,54,"111  >  45075 [RST, ACK] Seq=1 Ack=1 Win=0 Len=0"
227,0.4612931,10.0.1.2,10.0.1.3,TCP,74,35029  >  114 [SYN] Seq=0 Win=32120 Len=0 MSS=1460 SACK_PERM=1 TSval=3296992811 TSecr=0 WS=128
228,0.4614823,10.0.1.3,10.0.1.2,TCP,54,"114  >  35029 [RST, ACK] Seq=1 Ack=1 Win=0 Len=0"
229,0.4620229,10.0.1.2,10.0.1.3,TCP,74,44967  >  112 [SYN] Seq=0 Win=32120 Len=0 MSS=1460 SACK_PERM=1 TSval=3296992811 TSecr=0 WS=128
230,0.4622531,10.0.1.3,10.0.1.2,TCP,54,"112  >  44967 [RST, ACK] Seq=1 Ack=1 Win=0 Len=0"
231,0.4624762,10.0.1.2,10.0.1.3,TCP,74,35639  >  115 [SYN] Seq=0 Win=32120 Len=0 MSS=1460 SACK_PERM=1 TSval=3296992812 TSecr=0 WS=128
232,0.4635386,10.0.1.2,10.0.1.3,TCP,74,37403  >  120 [SYN] Seq=0 Win=32120 Len=0 MSS=1460 SACK_PERM=1 TSval=3296992813 TSecr=0 WS=128
233,0.4635657,10.0.1.2,10.0.1.3,TCP,74,39365  >  116 [SYN] Seq=0 Win=32120 Len=0 MSS=1460 SACK_PERM=1 TSval=3296992813 TSecr=0 WS=128
234,0.4638902,10.0.1.3,10.0.1.2,TCP,54,"115  >  35639 [RST, ACK] Seq=1 Ack=1 Win=0 Len=0"
235,0.4638979,10.0.1.3,10.0.1.2,TCP,54,"120  >  37403 [RST, ACK] Seq=1 Ack=1 Win=0 Len=0"
236,0.4638981,10.0.1.3,10.0.1.2,TCP,54,"116  >  39365 [RST, ACK] Seq=1 Ack=1 Win=0 Len=0"
237,0.4640883,10.0.1.2,10.0.1.3,TCP,74,42299  >  118 [SYN] Seq=0 Win=32120 Len=0 MSS=1460 SACK_PERM=1 TSval=3296992813 TSecr=0 WS=128
238,0.464505,10.0.1.2,10.0.1.3,TCP,74,43769  >  119 [SYN] Seq=0 Win=32120 Len=0 MSS=1460 SACK_PERM=1 TSval=3296992814 TSecr=0 WS=128
239,0.4648128,10.0.1.2,10.0.1.3,TCP,74,40547  >  117 [SYN] Seq=0 Win=32120 Len=0 MSS=1460 SACK_PERM=1 TSval=3296992814 TSecr=0 WS=128
240,0.4650844,10.0.1.3,10.0.1.2,TCP,54,"118  >  42299 [RST, ACK] Seq=1 Ack=1 Win=0 Len=0"
241,0.4650846,10.0.1.3,10.0.1.2,TCP,54,"119  >  43769 [RST, ACK] Seq=1 Ack=1 Win=0 Len=0"
242,0.4650847,10.0.1.3,10.0.1.2,TCP,54,"117  >  40547 [RST, ACK] Seq=1 Ack=1 Win=0 Len=0"
243,0.4713009,10.0.1.2,10.0.1.3,TCP,74,42799  >  121 [SYN] Seq=0 Win=32120 Len=0 MSS=1460 SACK_PERM=1 TSval=3296992821 TSecr=0 WS=128
244,0.4723188,10.0.1.3,10.0.1.2,TCP,54,"121  >  42799 [RST, ACK] Seq=1 Ack=1 Win=0 Len=0"
245,0.4724315,10.0.1.2,10.0.1.3,TCP,74,43557  >  129 [SYN] Seq=0 Win=32120 Len=0 MSS=1460 SACK_PERM=1 TSval=3296992822 TSecr=0 WS=128
246,0.472451,10.0.1.2,10.0.1.3,TCP,74,44515  >  123 [SYN] Seq=0 Win=32120 Len=0 MSS=1460 SACK_PERM=1 TSval=3296992822 TSecr=0 WS=128
247,0.4725936,10.0.1.3,10.0.1.2,TCP,54,"123  >  44515 [RST, ACK] Seq=1 Ack=1 Win=0 Len=0"
248,0.4725938,10.0.1.3,10.0.1.2,TCP,54,"129  >  43557 [RST, ACK] Seq=1 Ack=1 Win=0 Len=0"
249,0.4728502,10.0.1.2,10.0.1.3,TCP,74,41369  >  127 [SYN] Seq=0 Win=32120 Len=0 MSS=1460 SACK_PERM=1 TSval=3296992822 TSecr=0 WS=128
250,0.4731834,10.0.1.2,10.0.1.3,TCP,74,41343  >  128 [SYN] Seq=0 Win=32120 Len=0 MSS=1460 SACK_PERM=1 TSval=3296992823 TSecr=0 WS=128
251,0.473292,10.0.1.3,10.0.1.2,TCP,54,"128  >  41343 [RST, ACK] Seq=1 Ack=1 Win=0 Len=0"
252,0.4732922,10.0.1.3,10.0.1.2,TCP,54,"127  >  41369 [RST, ACK] Seq=1 Ack=1 Win=0 Len=0"
253,0.4736811,10.0.1.2,10.0.1.3,TCP,74,34407  >  125 [SYN] Seq=0 Win=32120 Len=0 MSS=1460 SACK_PERM=1 TSval=3296992823 TSecr=0 WS=128
254,0.4742557,10.0.1.3,10.0.1.2,TCP,54,"125  >  34407 [RST, ACK] Seq=1 Ack=1 Win=0 Len=0"
255,0.4743121,10.0.1.2,10.0.1.3,TCP,74,39255  >  122 [SYN] Seq=0 Win=32120 Len=0 MSS=1460 SACK_PERM=1 TSval=3296992824 TSecr=0 WS=128
256,0.4744045,10.0.1.3,10.0.1.2,TCP,54,"122  >  39255 [RST, ACK] Seq=1 Ack=1 Win=0 Len=0"
257,0.4748188,10.0.1.2,10.0.1.3,TCP,74,35749  >  130 [SYN] Seq=0 Win=32120 Len=0 MSS=1460 SACK_PERM=1 TSval=3296992824 TSecr=0 WS=128
258,0.474929,10.0.1.3,10.0.1.2,TCP,54,"130  >  35749 [RST, ACK] Seq=1 Ack=1 Win=0 Len=0"
259,0.4752347,10.0.1.2,10.0.1.3,TCP,74,40157  >  124 [SYN] Seq=0 Win=32120 Len=0 MSS=1460 SACK_PERM=1 TSval=3296992825 TSecr=0 WS=128
260,0.4758606,10.0.1.2,10.0.1.3,TCP,74,44589  >  126 [SYN] Seq=0 Win=32120 Len=0 MSS=1460 SACK_PERM=1 TSval=3296992825 TSecr=0 WS=128
261,0.4759853,10.0.1.3,10.0.1.2,TCP,54,"126  >  44589 [RST, ACK] Seq=1 Ack=1 Win=0 Len=0"
262,0.4759855,10.0.1.3,10.0.1.2,TCP,54,"124  >  40157 [RST, ACK] Seq=1 Ack=1 Win=0 Len=0"
263,0.4813921,10.0.1.2,10.0.1.3,TCP,74,41963  >  140 [SYN] Seq=0 Win=32120 Len=0 MSS=1460 SACK_PERM=1 TSval=3296992831 TSecr=0 WS=128
264,0.4817443,10.0.1.3,10.0.1.2,TCP,54,"140  >  41963 [RST, ACK] Seq=1 Ack=1 Win=0 Len=0"
265,0.4823066,10.0.1.2,10.0.1.3,TCP,74,40335  >  131 [SYN] Seq=0 Win=32120 Len=0 MSS=1460 SACK_PERM=1 TSval=3296992832 TSecr=0 WS=128
266,0.4826565,10.0.1.2,10.0.1.3,TCP,74,43355  >  133 [SYN] Seq=0 Win=32120 Len=0 MSS=1460 SACK_PERM=1 TSval=3296992832 TSecr=0 WS=128
267,0.4828519,10.0.1.3,10.0.1.2,TCP,54,"131  >  40335 [RST, ACK] Seq=1 Ack=1 Win=0 Len=0"
268,0.4828521,10.0.1.3,10.0.1.2,TCP,54,"133  >  43355 [RST, ACK] Seq=1 Ack=1 Win=0 Len=0"
269,0.4830812,10.0.1.2,10.0.1.3,TCP,74,36227  >  135 [SYN] Seq=0 Win=32120 Len=0 MSS=1460 SACK_PERM=1 TSval=3296992832 TSecr=0 WS=128
270,0.4833422,10.0.1.3,10.0.1.2,TCP,74,"135  >  36227 [SYN, ACK] Seq=0 Ack=1 Win=8192 Len=0 MSS=1460 WS=256 SACK_PERM=1 TSval=117303 TSecr=3296992832"
271,0.483372,10.0.1.2,10.0.1.3,TCP,66,36227  >  135 [ACK] Seq=1 Ack=1 Win=32128 Len=0 TSval=3296992833 TSecr=117303
272,0.4835113,10.0.1.2,10.0.1.3,TCP,74,40399  >  137 [SYN] Seq=0 Win=32120 Len=0 MSS=1460 SACK_PERM=1 TSval=3296992833 TSecr=0 WS=128
273,0.4837754,10.0.1.3,10.0.1.2,TCP,54,"137  >  40399 [RST, ACK] Seq=1 Ack=1 Win=0 Len=0"
274,0.4847119,10.0.1.2,10.0.1.3,TCP,74,43213  >  132 [SYN] Seq=0 Win=32120 Len=0 MSS=1460 SACK_PERM=1 TSval=3296992834 TSecr=0 WS=128
275,0.4847345,10.0.1.2,10.0.1.3,TCP,74,38021  >  138 [SYN] Seq=0 Win=32120 Len=0 MSS=1460 SACK_PERM=1 TSval=3296992834 TSecr=0 WS=128
276,0.4857428,10.0.1.2,10.0.1.3,TCP,74,41849  >  139 [SYN] Seq=0 Win=32120 Len=0 MSS=1460 SACK_PERM=1 TSval=3296992835 TSecr=0 WS=128
277,0.4857632,10.0.1.2,10.0.1.3,TCP,74,44101  >  134 [SYN] Seq=0 Win=32120 Len=0 MSS=1460 SACK_PERM=1 TSval=3296992835 TSecr=0 WS=128
278,0.4860909,10.0.1.2,10.0.1.3,TCP,74,41345  >  136 [SYN] Seq=0 Win=32120 Len=0 MSS=1460 SACK_PERM=1 TSval=3296992835 TSecr=0 WS=128
279,0.4865677,10.0.1.3,10.0.1.2,TCP,54,"138  >  38021 [RST, ACK] Seq=1 Ack=1 Win=0 Len=0"
280,0.4865656,10.0.1.3,10.0.1.2,TCP,54,"132  >  43213 [RST, ACK] Seq=1 Ack=1 Win=0 Len=0"
281,0.486568,10.0.1.3,10.0.1.2,TCP,74,"139  >  41849 [SYN, ACK] Seq=0 Ack=1 Win=8192 Len=0 MSS=1460 WS=256 SACK_PERM=1 TSval=117303 TSecr=3296992835"
282,0.4865681,10.0.1.3,10.0.1.2,TCP,54,"134  >  44101 [RST, ACK] Seq=1 Ack=1 Win=0 Len=0"
283,0.4865682,10.0.1.3,10.0.1.2,TCP,54,"136  >  41345 [RST, ACK] Seq=1 Ack=1 Win=0 Len=0"
284,0.4866121,10.0.1.2,10.0.1.3,TCP,66,41849  >  139 [ACK] Seq=1 Ack=1 Win=32128 Len=0 TSval=3296992836 TSecr=117303
285,0.4896214,10.0.1.2,10.0.1.3,TCP,66,"41849  >  139 [FIN, ACK] Seq=1 Ack=1 Win=32128 Len=0 TSval=3296992839 TSecr=117303"
286,0.4900193,10.0.1.3,10.0.1.2,TCP,66,"139  >  41849 [FIN, ACK] Seq=1 Ack=2 Win=131584 Len=0 TSval=117304 TSecr=3296992839"
287,0.4900578,10.0.1.2,10.0.1.3,TCP,66,41849  >  139 [ACK] Seq=2 Ack=2 Win=32128 Len=0 TSval=3296992839 TSecr=117304
288,0.4924935,10.0.1.2,10.0.1.3,TCP,66,"36227  >  135 [FIN, ACK] Seq=1 Ack=1 Win=32128 Len=0 TSval=3296992842 TSecr=117303"
289,0.4929002,10.0.1.3,10.0.1.2,TCP,66,135  >  36227 [ACK] Seq=1 Ack=2 Win=131584 Len=0 TSval=117304 TSecr=3296992842
290,0.4929005,10.0.1.3,10.0.1.2,TCP,66,"135  >  36227 [FIN, ACK] Seq=1 Ack=2 Win=131584 Len=0 TSval=117304 TSecr=3296992842"
291,0.492945,10.0.1.2,10.0.1.3,TCP,66,36227  >  135 [ACK] Seq=2 Ack=2 Win=32128 Len=0 TSval=3296992842 TSecr=117304
292,0.523745,10.0.1.2,10.0.1.3,TCP,74,36613  >  142 [SYN] Seq=0 Win=32120 Len=0 MSS=1460 SACK_PERM=1 TSval=3296992873 TSecr=0 WS=128
293,0.5240033,10.0.1.3,10.0.1.2,TCP,54,"142  >  36613 [RST, ACK] Seq=1 Ack=1 Win=0 Len=0"
294,0.5244656,10.0.1.2,10.0.1.3,TCP,74,38281  >  144 [SYN] Seq=0 Win=32120 Len=0 MSS=1460 SACK_PERM=1 TSval=3296992874 TSecr=0 WS=128
295,0.5244912,10.0.1.2,10.0.1.3,TCP,74,38941  >  143 [SYN] Seq=0 Win=32120 Len=0 MSS=1460 SACK_PERM=1 TSval=3296992874 TSecr=0 WS=128
296,0.5248361,10.0.1.2,10.0.1.3,TCP,74,36679  >  147 [SYN] Seq=0 Win=32120 Len=0 MSS=1460 SACK_PERM=1 TSval=3296992874 TSecr=0 WS=128
297,0.5255667,10.0.1.2,10.0.1.3,TCP,74,39077  >  146 [SYN] Seq=0 Win=32120 Len=0 MSS=1460 SACK_PERM=1 TSval=3296992875 TSecr=0 WS=128
298,0.5259023,10.0.1.2,10.0.1.3,TCP,74,33537  >  148 [SYN] Seq=0 Win=32120 Len=0 MSS=1460 SACK_PERM=1 TSval=3296992875 TSecr=0 WS=128
299,0.5261796,10.0.1.3,10.0.1.2,TCP,54,"144  >  38281 [RST, ACK] Seq=1 Ack=1 Win=0 Len=0"
300,0.5261803,10.0.1.3,10.0.1.2,TCP,54,"143  >  38941 [RST, ACK] Seq=1 Ack=1 Win=0 Len=0"
301,0.5261805,10.0.1.3,10.0.1.2,TCP,54,"148  >  33537 [RST, ACK] Seq=1 Ack=1 Win=0 Len=0"
302,0.5263647,10.0.1.3,10.0.1.2,TCP,54,"147  >  36679 [RST, ACK] Seq=1 Ack=1 Win=0 Len=0"
303,0.5263649,10.0.1.3,10.0.1.2,TCP,54,"146  >  39077 [RST, ACK] Seq=1 Ack=1 Win=0 Len=0"
304,0.5269216,10.0.1.2,10.0.1.3,TCP,74,43241  >  145 [SYN] Seq=0 Win=32120 Len=0 MSS=1460 SACK_PERM=1 TSval=3296992876 TSecr=0 WS=128
305,0.5271113,10.0.1.3,10.0.1.2,TCP,54,"145  >  43241 [RST, ACK] Seq=1 Ack=1 Win=0 Len=0"
306,0.5277868,10.0.1.2,10.0.1.3,TCP,74,41423  >  149 [SYN] Seq=0 Win=32120 Len=0 MSS=1460 SACK_PERM=1 TSval=3296992877 TSecr=0 WS=128
307,0.5286965,10.0.1.2,10.0.1.3,TCP,74,46309  >  150 [SYN] Seq=0 Win=32120 Len=0 MSS=1460 SACK_PERM=1 TSval=3296992878 TSecr=0 WS=128
308,0.5290839,10.0.1.3,10.0.1.2,TCP,54,"150  >  46309 [RST, ACK] Seq=1 Ack=1 Win=0 Len=0"
309,0.5290843,10.0.1.3,10.0.1.2,TCP,54,"149  >  41423 [RST, ACK] Seq=1 Ack=1 Win=0 Len=0"
310,0.5295378,10.0.1.2,10.0.1.3,TCP,74,43787  >  141 [SYN] Seq=0 Win=32120 Len=0 MSS=1460 SACK_PERM=1 TSval=3296992879 TSecr=0 WS=128
311,0.5297233,10.0.1.3,10.0.1.2,TCP,54,"141  >  43787 [RST, ACK] Seq=1 Ack=1 Win=0 Len=0"
312,0.5356567,10.0.1.2,10.0.1.3,TCP,74,34353  >  151 [SYN] Seq=0 Win=32120 Len=0 MSS=1460 SACK_PERM=1 TSval=3296992885 TSecr=0 WS=128
313,0.5359427,10.0.1.3,10.0.1.2,TCP,54,"151  >  34353 [RST, ACK] Seq=1 Ack=1 Win=0 Len=0"
314,0.5361833,10.0.1.2,10.0.1.3,TCP,74,44925  >  152 [SYN] Seq=0 Win=32120 Len=0 MSS=1460 SACK_PERM=1 TSval=3296992886 TSecr=0 WS=128
315,0.5363138,10.0.1.3,10.0.1.2,TCP,54,"152  >  44925 [RST, ACK] Seq=1 Ack=1 Win=0 Len=0"
316,0.5365921,10.0.1.2,10.0.1.3,TCP,74,45913  >  155 [SYN] Seq=0 Win=32120 Len=0 MSS=1460 SACK_PERM=1 TSval=3296992886 TSecr=0 WS=128
317,0.5367078,10.0.1.3,10.0.1.2,TCP,54,"155  >  45913 [RST, ACK] Seq=1 Ack=1 Win=0 Len=0"
318,0.537288,10.0.1.2,10.0.1.3,TCP,74,33273  >  157 [SYN] Seq=0 Win=32120 Len=0 MSS=1460 SACK_PERM=1 TSval=3296992887 TSecr=0 WS=128
319,0.5375002,10.0.1.3,10.0.1.2,TCP,54,"157  >  33273 [RST, ACK] Seq=1 Ack=1 Win=0 Len=0"
320,0.5377049,10.0.1.2,10.0.1.3,TCP,74,40627  >  158 [SYN] Seq=0 Win=32120 Len=0 MSS=1460 SACK_PERM=1 TSval=3296992887 TSecr=0 WS=128
321,0.537872,10.0.1.3,10.0.1.2,TCP,54,"158  >  40627 [RST, ACK] Seq=1 Ack=1 Win=0 Len=0"
322,0.538582,10.0.1.2,10.0.1.3,TCP,74,45287  >  153 [SYN] Seq=0 Win=32120 Len=0 MSS=1460 SACK_PERM=1 TSval=3296992888 TSecr=0 WS=128
323,0.5386037,10.0.1.2,10.0.1.3,TCP,74,45371  >  159 [SYN] Seq=0 Win=32120 Len=0 MSS=1460 SACK_PERM=1 TSval=3296992888 TSecr=0 WS=128
324,0.5387602,10.0.1.3,10.0.1.2,TCP,54,"153  >  45287 [RST, ACK] Seq=1 Ack=1 Win=0 Len=0"
325,0.5387821,10.0.1.3,10.0.1.2,TCP,54,"159  >  45371 [RST, ACK] Seq=1 Ack=1 Win=0 Len=0"
326,0.5393565,10.0.1.2,10.0.1.3,TCP,74,38149  >  156 [SYN] Seq=0 Win=32120 Len=0 MSS=1460 SACK_PERM=1 TSval=3296992889 TSecr=0 WS=128
327,0.5395028,10.0.1.3,10.0.1.2,TCP,54,"156  >  38149 [RST, ACK] Seq=1 Ack=1 Win=0 Len=0"
328,0.5398081,10.0.1.2,10.0.1.3,TCP,74,35689  >  160 [SYN] Seq=0 Win=32120 Len=0 MSS=1460 SACK_PERM=1 TSval=3296992889 TSecr=0 WS=128
329,0.5399488,10.0.1.3,10.0.1.2,TCP,54,"160  >  35689 [RST, ACK] Seq=1 Ack=1 Win=0 Len=0"
330,0.5402567,10.0.1.2,10.0.1.3,TCP,74,45607  >  154 [SYN] Seq=0 Win=32120 Len=0 MSS=1460 SACK_PERM=1 TSval=3296992890 TSecr=0 WS=128
331,0.5403994,10.0.1.3,10.0.1.2,TCP,54,"154  >  45607 [RST, ACK] Seq=1 Ack=1 Win=0 Len=0"
332,0.5470057,10.0.1.2,10.0.1.3,TCP,74,39647  >  170 [SYN] Seq=0 Win=32120 Len=0 MSS=1460 SACK_PERM=1 TSval=3296992896 TSecr=0 WS=128
333,0.5472947,10.0.1.3,10.0.1.2,TCP,54,"170  >  39647 [RST, ACK] Seq=1 Ack=1 Win=0 Len=0"
334,0.5474151,10.0.1.2,10.0.1.3,TCP,74,43605  >  161 [SYN] Seq=0 Win=32120 Len=0 MSS=1460 SACK_PERM=1 TSval=3296992897 TSecr=0 WS=128
335,0.5475631,10.0.1.3,10.0.1.2,TCP,54,"161  >  43605 [RST, ACK] Seq=1 Ack=1 Win=0 Len=0"
336,0.548089,10.0.1.2,10.0.1.3,TCP,74,36241  >  162 [SYN] Seq=0 Win=32120 Len=0 MSS=1460 SACK_PERM=1 TSval=3296992897 TSecr=0 WS=128
337,0.5482437,10.0.1.3,10.0.1.2,TCP,54,"162  >  36241 [RST, ACK] Seq=1 Ack=1 Win=0 Len=0"
338,0.5485262,10.0.1.2,10.0.1.3,TCP,74,45823  >  165 [SYN] Seq=0 Win=32120 Len=0 MSS=1460 SACK_PERM=1 TSval=3296992898 TSecr=0 WS=128
339,0.5486848,10.0.1.3,10.0.1.2,TCP,54,"165  >  45823 [RST, ACK] Seq=1 Ack=1 Win=0 Len=0"
340,0.5489494,10.0.1.2,10.0.1.3,TCP,74,42349  >  167 [SYN] Seq=0 Win=32120 Len=0 MSS=1460 SACK_PERM=1 TSval=3296992898 TSecr=0 WS=128
341,0.5490985,10.0.1.3,10.0.1.2,TCP,54,"167  >  42349 [RST, ACK] Seq=1 Ack=1 Win=0 Len=0"
342,0.5496277,10.0.1.2,10.0.1.3,TCP,74,40143  >  169 [SYN] Seq=0 Win=32120 Len=0 MSS=1460 SACK_PERM=1 TSval=3296992899 TSecr=0 WS=128
343,0.549836,10.0.1.3,10.0.1.2,TCP,54,"169  >  40143 [RST, ACK] Seq=1 Ack=1 Win=0 Len=0"
344,0.550009,10.0.1.2,10.0.1.3,TCP,74,41643  >  163 [SYN] Seq=0 Win=32120 Len=0 MSS=1460 SACK_PERM=1 TSval=3296992899 TSecr=0 WS=128
345,0.5501845,10.0.1.3,10.0.1.2,TCP,54,"163  >  41643 [RST, ACK] Seq=1 Ack=1 Win=0 Len=0"
346,0.5504659,10.0.1.2,10.0.1.3,TCP,74,36967  >  168 [SYN] Seq=0 Win=32120 Len=0 MSS=1460 SACK_PERM=1 TSval=3296992900 TSecr=0 WS=128
347,0.5506197,10.0.1.3,10.0.1.2,TCP,54,"168  >  36967 [RST, ACK] Seq=1 Ack=1 Win=0 Len=0"
348,0.5508931,10.0.1.2,10.0.1.3,TCP,74,45991  >  164 [SYN] Seq=0 Win=32120 Len=0 MSS=1460 SACK_PERM=1 TSval=3296992900 TSecr=0 WS=128
349,0.5510275,10.0.1.3,10.0.1.2,TCP,54,"164  >  45991 [RST, ACK] Seq=1 Ack=1 Win=0 Len=0"
350,0.551608,10.0.1.2,10.0.1.3,TCP,74,43871  >  166 [SYN] Seq=0 Win=32120 Len=0 MSS=1460 SACK_PERM=1 TSval=3296992901 TSecr=0 WS=128
351,0.5517606,10.0.1.3,10.0.1.2,TCP,54,"166  >  43871 [RST, ACK] Seq=1 Ack=1 Win=0 Len=0"
352,0.5575876,10.0.1.2,10.0.1.3,TCP,74,40693  >  180 [SYN] Seq=0 Win=32120 Len=0 MSS=1460 SACK_PERM=1 TSval=3296992907 TSecr=0 WS=128
353,0.5579673,10.0.1.3,10.0.1.2,TCP,54,"180  >  40693 [RST, ACK] Seq=1 Ack=1 Win=0 Len=0"
354,0.5580722,10.0.1.2,10.0.1.3,TCP,74,35243  >  171 [SYN] Seq=0 Win=32120 Len=0 MSS=1460 SACK_PERM=1 TSval=3296992907 TSecr=0 WS=128
355,0.5582282,10.0.1.3,10.0.1.2,TCP,54,"171  >  35243 [RST, ACK] Seq=1 Ack=1 Win=0 Len=0"
356,0.558521,10.0.1.2,10.0.1.3,TCP,74,34321  >  174 [SYN] Seq=0 Win=32120 Len=0 MSS=1460 SACK_PERM=1 TSval=3296992908 TSecr=0 WS=128
357,0.5586984,10.0.1.3,10.0.1.2,TCP,54,"174  >  34321 [RST, ACK] Seq=1 Ack=1 Win=0 Len=0"
358,0.5588944,10.0.1.2,10.0.1.3,TCP,74,41091  >  175 [SYN] Seq=0 Win=32120 Len=0 MSS=1460 SACK_PERM=1 TSval=3296992908 TSecr=0 WS=128
359,0.5590539,10.0.1.3,10.0.1.2,TCP,54,"175  >  41091 [RST, ACK] Seq=1 Ack=1 Win=0 Len=0"
360,0.5593067,10.0.1.2,10.0.1.3,TCP,74,36363  >  176 [SYN] Seq=0 Win=32120 Len=0 MSS=1460 SACK_PERM=1 TSval=3296992909 TSecr=0 WS=128
